{
  "schemaVersion": "1.0.0",
  "catalogId": "gemuera.m0.dialect-policy-surface",
  "catalogVersion": "1.0.0",
  "sourceWorkPackage": "M0-DIA-15",
  "sourcePolicyConsumerBoundaryWorkPackage": "M0-DIA-14",
  "sourceDeclarationVocabularyWorkPackage": "M0-DIA-13",
  "sourcePolicyConsumerBoundaryHash": "beedf972b5004b39debcc3a88d72cb4cb2988e660504e9a5e836d7a61fd43c6b",
  "sourceDeclarationVocabularyHash": "766c3f843f39749010d61b693b1fbef41164ef04bff2ac27e1469e193d5d98c4",
  "expectedBehaviorKeyCount": 10,
  "expectedContractCount": 10,
  "expectedPolicyDecisionCount": 6,
  "expectedBridgeProjectionCount": 2,
  "expectedFrozenCatalogContributionCount": 2,
  "contracts": [
    {"behaviorKeyId":"call.extra-arguments.v1","consumerContractId":"policy.call.extra-arguments.v1","decisionOwner":"IExtraArgumentPolicy","portTypeId":"IExtraArgumentPolicy","contractKind":"PolicyDecision","contractDraftStatus":"InterfaceDraftOnly","policyValueStatus":"Unspecified"},
    {"behaviorKeyId":"call.private-argument-shape.v1","consumerContractId":"policy.call.private-argument-shape.v1","decisionOwner":"IPrivateArgumentShapePolicy","portTypeId":"IPrivateArgumentShapePolicy","contractKind":"PolicyDecision","contractDraftStatus":"InterfaceDraftOnly","policyValueStatus":"Unspecified"},
    {"behaviorKeyId":"display.history-capacity.v1","consumerContractId":"bridge.display.history-capacity.v1","decisionOwner":"effective display configuration projection","portTypeId":"IEffectiveDisplayConfigurationProjection","contractKind":"BridgeProjection","contractDraftStatus":"InterfaceDraftOnly","policyValueStatus":"Unspecified"},
    {"behaviorKeyId":"display.refresh-timing.v1","consumerContractId":"bridge.display.refresh-timing.v1","decisionOwner":"display timing policy consumed by Bridge","portTypeId":"IDisplayRefreshTimingPolicy","contractKind":"BridgeProjection","contractDraftStatus":"InterfaceDraftOnly","policyValueStatus":"Unspecified"},
    {"behaviorKeyId":"function.snake-fallen-state.v1","consumerContractId":"catalog.expression.snake-fallen-state.v1","decisionOwner":"frozen expression function catalog","portTypeId":"IExpressionFunctionCatalog","contractKind":"FrozenCatalogContribution","contractDraftStatus":"InterfaceDraftOnly","policyValueStatus":"Unspecified"},
    {"behaviorKeyId":"instruction.scoped-variable-registration.v1","consumerContractId":"catalog.instruction.scoped-variable-registration.v1","decisionOwner":"frozen DialectPlan instruction catalog builder","portTypeId":"IInstructionCatalogBuilder","contractKind":"FrozenCatalogContribution","contractDraftStatus":"InterfaceDraftOnly","policyValueStatus":"Unspecified"},
    {"behaviorKeyId":"parser.startup-fault.v1","consumerContractId":"policy.parser.startup-fault.v1","decisionOwner":"IStartupFaultPolicy","portTypeId":"IStartupFaultPolicy","contractKind":"PolicyDecision","contractDraftStatus":"InterfaceDraftOnly","policyValueStatus":"Unspecified"},
    {"behaviorKeyId":"parser.user-variable-resolution.v1","consumerContractId":"policy.parser.user-variable-resolution.v1","decisionOwner":"IUserVariableResolutionPolicy","portTypeId":"IUserVariableResolutionPolicy","contractKind":"PolicyDecision","contractDraftStatus":"InterfaceDraftOnly","policyValueStatus":"Unspecified"},
    {"behaviorKeyId":"parser.warning-routing.v1","consumerContractId":"policy.parser.warning-routing.v1","decisionOwner":"parser diagnostics sink policy","portTypeId":"IParserDiagnosticsSinkPolicy","contractKind":"PolicyDecision","contractDraftStatus":"InterfaceDraftOnly","policyValueStatus":"Unspecified"},
    {"behaviorKeyId":"resource.lazy-index.v1","consumerContractId":"policy.resource.lazy-index.v1","decisionOwner":"resource behavior consumer","portTypeId":"IResourceLazyIndexPolicy","contractKind":"PolicyDecision","contractDraftStatus":"InterfaceDraftOnly","policyValueStatus":"Unspecified"}
  ]
}
